Year,Title,Genre,Plot,Actors,Director,Rated,Runtime,Metascore
2002,The Real World Movie: The Lost Season,Comedy,"Things get a little crazy when an obsessed fan, who has been rejected during the audition process numerous times, kidnaps the cast and brings them to a new house. Here, he films them, using highly sophisticated camera equipment th...","Bryan Kirkwood, Matthew Currie Holmes, Shani Pride",Jeffrey Reiner,N/A,87 min,N/A
2003,Scary Movie 3,Comedy,"Cindy must investigate mysterious crop circles and video tapes, and help the President in preventing an alien invasion.","Anna Faris, Charlie Sheen, Regina Hall",David Zucker,PG-13,84 min,49
2003,The Lizzie McGuire Movie,"Adventure, Comedy, Family","Lizzie McGuire has graduated from middle school and takes a trip to Rome, Italy with her class. And what was supposed to be only a normal trip, becomes a teenager's dream come true.","Hilary Duff, Adam Lamberg, Clayton Snyder",Jim Fall,PG,94 min,56
2003,Piglet's Big Movie,"Animation, Adventure, Comedy","When Piglet comes up missing his Hundred Acre Wood friends use Piglet's own Book of Memories to find him, discovering along the way just how big a role he's played in their lives.","John Fiedler, Jim Cummings, Ken Sansom",Francis Glebas,G,75 min,62
2003,Stitch! The Movie,"Animation, Adventure, Comedy, Family, Sci-Fi","Stitch, an alien living on Earth disguised as a dog with his human family, continues his adventures when he discovers that the alien family he never knew he had is now in Hawaii, being hunted down by galactic forces.","Daveigh Chase, Chris Sanders, Tia Carrere, David Ogden Stiers","Tony Craig, Roberts Gannaway",G,60 min,N/A
2003,The Even Stevens Movie,"Comedy, Family","Dream vacation Dream on! Ren, Louis, and the entire Stevens family battle ferocious squirrels, angry natives and one another on the adventure of a lifetime.","Shia LaBeouf, Christy Carlson Romano, Donna Pescow",Sean McNamara,TV-G,93 min,N/A
2003,Blue Collar Comedy Tour: The Movie,"Comedy, Documentary",The comedic stylings of four sort-of famous funnymen are brought to the big screen courtesy of this 2002 documentary.,"Jeff Foxworthy, Bill Engvall, Ron White",C.B. Harding,PG-13,105 min,70
2003,The Last Horror Movie,"Horror, Thriller","A serial killer uses a horror video rental to lure his next victim. What begins as a teen slasher transforms into a disturbing journey through the mind of Max Parry, a mild mannered wedding photographer with a taste for human flesh.","Kevin Howarth, Mark Stevenson, Antonia Beamish",Julian Richards,R,80 min,N/A
2003,InuYasha the Movie 3: Swords of an Honorable Ruler,"Animation, Action, Adventure","After 700 years the sword Sounga, who belonged to the Great Dog Demon, is unleashed, tearing a rift in the barrier between the underworld and the earth and stirring the restless souls.","Kappei Yamaguchi, Satsuki Yukino, Kôji Tsujitani",Toshiya Shinohara,Not Rated,99 min,N/A
2003,15: The Movie,"Drama, Comedy","Fast, frenetic, and furious, 15 is story of five Singaporian teenagers who, abandoned by system.","Melvin Chen, Erick Chun, Melvin Lee",Royston Tan,TV-MA,96 min,47
2003,The Movie Hero,"Comedy, Romance",A man believes his life is a movie watched by an audience only he can see.,"Jeremy Sisto, Dina Meyer, Peter Stormare",Brad T. Gottfred,Not Rated,98 min,N/A
2004,The SpongeBob SquarePants Movie,"Animation, Adventure, Comedy","SpongeBob takes leave from Bikini Bottom in order to track down, with Patrick, King Neptune's stolen crown.","Tom Kenny, Jeffrey Tambor, Rodger Bumpass","Stephen Hillenburg, Mark Osborne",PG,87 min,66
2004,Garfield: The Movie,"Adventure, Comedy, Family","Jon Arbuckle buys a second pet, a dog named Odie. However, Odie is then abducted and it is up to Jon's cat, Garfield, to find and rescue the canine.","Breckin Meyer, Jennifer Love Hewitt, Stephen Tobolowsky",Peter Hewitt,PG,80 min,27
2004,Yu-Gi-Oh!: The Movie - Pyramid of Light,"Animation, Action, Adventure","Underneath the sands of Egypt, Anubis, an ancient evil spirit, has awakened. It's up to Yugi, who defeated Anubis centuries ago, to use his skill and determination to rid the world of evil once again.","Dan Green, Eric Stuart, Amy Birnbaum",Hatsuki Tsuji,PG,90 min,15
2004,Naruto the Movie: Ninja Clash in the Land of Snow,"Animation, Action, Adventure",Naruto and his team are hired to protect a young actress from three rogue warriors in the Land of the Snow.,"Junko Takeuchi, Chie Nakamura, Noriaki Sugiyama",Tensai Okamura,TV-14,82 min,N/A
2004,Pokémon the Movie: Destiny Deoxys,"Animation, Action, Adventure","A comet bearing a deadly Pokemon creature crash-lands onto Earth, terrorising a nearby high-tech city, where Ash, Pikachu and friends are currently visiting...","Veronica Taylor, Eric Stuart, Amy Birnbaum",Kunihiko Yuyama,Not Rated,98 min,N/A
2004,The Cutting Edge: The Magic of Movie Editing,"Documentary, History",Documentary about the art of film editing. Clips are shown from many groundbreaking films with innovative editing styles.,"Kathy Bates, Zach Staenberg, Jodie Foster",Wendy Apple,TV-PG,98 min,N/A
2004,Inuyasha the Movie 4: Fire on the Mystic Island,"Animation, Action, Adventure",The past catches up with the world of Inuyasha and Kagome's present in a form they could never have anticipated.,"Kappei Yamaguchi, Satsuki Yukino, Kôji Tsujitani",Toshiya Shinohara,Not Rated,89 min,N/A
2004,Comic Book: The Movie,Comedy,The relationship between Hollywood and comic book culture is lambasted in this mockumentary as a beloved heroic character is rung through the studio system.,"Mark Hamill, Donna D'Errico, Billy West, Joseph Burns",Mark Hamill,PG-13,106 min,N/A
2004,Clifford's Really Big Movie,"Animation, Adventure, Comedy","Worried that he costs too much to feed, Clifford runs away to join a carnival act and help win a lifetime supply of Tummy Yummies.","John Ritter, Cree Summer, Kel Mitchell","Robert C. Ramirez, Steve Trenbirth",G,74 min,49
2004,See This Movie,Comedy,Two bumbling but determined three-day film school graduates enter the Montreal World Film Festival with a feature film that doesn't exist.,"John Cho, Seth Meyers, Raymond O'Connor",David M. Rosenthal,R,82 min,N/A
2005,Fullmetal Alchemist the Movie: Conqueror of Shamballa,"Animation, Action, Adventure","Edward Elric, an alchemist from an alternate world, races to prevent the Thule Society from harnessing alchemy to wage war on his home.","Vic Mignogna, Aaron Dismuke, Jason Liebrecht",Seiji Mizushima,PG-13,105 min,N/A
2005,Pooh's Heffalump Movie,"Animation, Adventure, Comedy","When Roo sets off on his own into the Hundred Acre Wood, he discovers a friendly and playful Heffalump named Lumpy.","Jim Cummings, Brenda Blethyn, Kyle Stanger",Frank Nissen,G,68 min,64
2005,Reefer Madness: The Movie Musical,"Comedy, Drama, Horror",An outrageous tongue-in-cheek musical comedy adaptation of the classic anti-marijuana propaganda film Reefer Madness (1936).,"Kristen Bell, Christian Campbell, Neve Campbell",Andy Fickman,R,109 min,N/A
2005,Naruto the Movie 2: Legend of the Stone of Gelel,"Animation, Action, Adventure","Naruto, Shikamaru and Sakura are on a mission to deliver a lost pet to a village when a mysterious knight appear to confront them.","Junko Takeuchi, Shôtarô Morikubo, Chie Nakamura",Hirotsugu Kawasaki,TV-14,97 min,N/A
2005,Sad Movie,"Comedy, Drama, Romance","This film follows the lives of four very different couples as they deal with love, loss and life in these romantic, loosely interconnected tales.","Jung Woo-sung, Lim Soo-jung, Cha Tae-hyun",Kwon Jong-kwan,Not Rated,108 min,N/A
2005,The Proud Family Movie,"Animation, Adventure, Comedy","Penny and her family are lured on an all expenses paid vacation where a mad scientist captures them, refusing to let them go because Oscar won't reveal his one of his secret Proud Snacks formulas.","Tommy Davidson, Kyla Pratt, Paula Jai Parker",Bruce W. Smith,TV-G,90 min,N/A
2005,A Movie of Eggs,"Animation, Comedy, Family",A small egg named Toto decides that he doesn't want to become the breakfast and starts an adventure to become a chicken.,"Bruno Bichir, Carlos Espejel, Angélica Vale","Gabriel Riva Palacio Alatriste, Rodolfo Riva Palacio Alatriste",TV-PG,90 min,N/A
2005,My Big Fat Independent Movie,Comedy,"""My Big Fat Independent Movie"" is a spoof along the lines of ""Scary Movie"" and ""Not Another Teen Movie."" It includes parodies of some of the indie film world's most renowned movies such as ""Memento,"" ""Pulp Fiction,"" ""Magnolia,"" ""M...","Paget Brewster, Neil Barton, Eric Hoffman",Philip Zlotorynski,R,80 min,32
2005,The Naked Brothers Band: The Movie,"Comedy, Family, Music","When a famous band called the Silver Boulders break up, Nat and Alex Wolff go into depression.","Nat Wolff, Alex Wolff, Cooper Pillot",Polly Draper,G,90 min,N/A
2005,Pooh's Heffalump Halloween Movie,"Animation, Comedy, Family, Fantasy, Musical","Lumpy teams with tiny Roo for a Halloween adventure in the Hundred Acre Wood, in this animated tale about friendship, bravery, and teamwork.","Jimmy Bennett, Peter Cullen, Jim Cummings, John Fiedler","Saul Blinkoff, Elliot M. Bour",G,67 min,N/A
2006,Scary Movie 4,Comedy,Cindy finds out a little boy haunts the house she lives in and she goes on a quest to solve his murder.,"Anna Faris, Regina Hall, Craig Bierko",David Zucker,PG-13,83 min,40
2006,Date Movie,"Comedy, Romance","Spoof of romantic comedies which focuses on a man, his crush, his parents, and her father.","Alyson Hannigan, Adam Campbell, Fred Willard","Aaron Seltzer, Jason Friedberg",PG-13,83 min,11
2006,Trailer Park Boys: The Movie,"Comedy, Crime","Ricky, Julian, and Bubbles come up with a scheme to steal large amounts of untraceable coins.","Robb Wells, John Paul Tremblay, Mike Smith",Mike Clattenburg,R,95 min,38
2006,Ultimate Avengers: The Movie,"Animation, Action, Adventure, Sci-Fi","To confront an alien menace, General Fury assembles a team of superheroes lead by a recently resuscitated Captain America.","Justin Gross, Grey Griffin, Michael Massee, Marc Worden","Curt Geda, Steven E. Gordon, Bob Richardson",PG-13,72 min,N/A
2006,Another Gay Movie,"Comedy, Romance",Four gay high school friends make a pact to lose their virginity before they go to college.,"Michael Carbonaro, Jonathan Chase, Jonah Blechman",Todd Stephens,Not Rated,92 min,37
2006,Naruto the Movie 3: Guardians of the Crescent Moon Kingdom,"Animation, Action, Adventure","Naruto, Kakashi, Sakura, and Rock Lee are assigned to protect Michiru, the prince of the Land of the Moon, while he travel the world. The prince purchased a tiger Sham and the whole circus, which became the team's protection.","Junko Takeuchi, Chie Nakamura, Yôichi Masukawa",Toshiyuki Tsuru,TV-14,95 min,N/A
2006,Dirty Sanchez: The Movie,"Documentary, Action, Comedy","Four guys set off on a world tour to enact the seven deadly sins. Based on the MTV Europe series ""Dirty Sanchez"".","Mathew Pritchard, Lee Dainton, Michael Locke",Jim Hickey,R,94 min,N/A
2006,The Dudesons Movie,"Documentary, Action, Comedy","""The Dudesons Movie"" is an extreme stunts comedy that features the wild antics of four hilarious, lifelong friends and their crazy lives in the Arctic Circle.","Jarno Leppälä, Jukka Hilden, Jarno Laasala","Jarno Laasala, Tuukka Tiensuu",Not Rated,75 min,N/A
2006,Doraemon the Movie: Nobita's Dinosaur,"Animation, Adventure, Comedy","After bringing a fossilized egg back to life with the Time Cloth, Nobita finds himself the owner of a baby dinosaur. Everything is fine until it grows up. Nobita and friends use Doraemon's time machine to return it back to its own...","Misato Fukuen, Eiichirô Funakoshi, Fumihiko Gotô","Ayumu Watanabe, Kôzô Kusuba",PG,107 min,N/A
2006,Mushi-Shi: The Movie,"Drama, Fantasy",A wandering mystical doctor passes through remote regions of Japan uncovering supernatural creatures called the Mushi and curing people of their effects.,"Joe Odagiri, Nao Ômori, Yû Aoi",Katsuhiro Ôtomo,N/A,131 min,N/A
2007,The Simpsons Movie,"Animation, Adventure, Comedy","After Homer pollutes the town's water supply, Springfield is encased in a gigantic dome by the EPA and the Simpsons are declared fugitives.","Dan Castellaneta, Julie Kavner, Nancy Cartwright",David Silverman,PG-13,87 min,80
2007,Bee Movie,"Animation, Adventure, Comedy","Barry B. Benson, a bee just graduated from college, is disillusioned at his lone career choice: making honey. On a special trip outside the hive, Barry's life is saved by Vanessa, a florist in New York City. As their relationship ...","Jerry Seinfeld, Renée Zellweger, Matthew Broderick","Simon J. Smith, Steve Hickner",PG,91 min,54
2007,Epic Movie,"Adventure, Comedy, Fantasy","A spoof on previous years' epic movies (The Da Vinci Code (2006), The Chronicles of Narnia: The Lion, the Witch and the Wardrobe (2005) + 20 more), TV series, music videos and celebs. 4 orphans are on an epic adventure.","Kal Penn, Jennifer Coolidge, Fred Willard","Jason Friedberg, Aaron Seltzer",PG-13,86 min,17
2007,Aqua Teen Hunger Force Colon Movie Film for Theaters,"Animation, Action, Adventure","An action epic that explores the origins of Master Shake, Frylock, and Meatwad, better known as the Aqua Teen Hunger Force, who somehow become pitted in a battle over an immortal piece of exercise equipment.","Dana Snyder, Dave Willis, Carey Means","Matt Maiellaro, Dave Willis",R,86 min,54
2007,Naruto Shippûden: The Movie,"Animation, Action, Adventure","A powerful spirit that once threatened to destroy the world is back! Naruto's mission is to protect a priestess named Shion, who is the only one with the power to seal away the monster.","Junko Takeuchi, Chie Nakamura, Yôichi Masukawa",Hajime Kamegaki,Not Rated,94 min,N/A
2007,Kill Buljo: The Movie,"Action, Adventure, Comedy","When a likable hillbilly sees his fiance, friends and family ruthlessly gunned down at his engagement party, he becomes determined to get revenge - as soon as he wakes up from his coma.","Stig Frode Henriksen, Tommy Wirkola, Linda Øverlie Nilsen",Tommy Wirkola,R,93 min,N/A
2007,Bleach the Movie 2: The DiamondDust Rebellion,"Animation, Action, Mystery","After the treasured Ouin is stolen, Toshiro Hitsugaya disappears and becomes suspected of treason. When the Soul Society calls for his capture and execution, Substitute Soul Reaper Ichigo Kurosaki vows to prove Hitsugaya's innocence.","Masakazu Morita, Fumiko Orikasa, Hiroki Yasumoto",Noriyuki Abe,TV-14,92 min,N/A
2007,"Basic Sanitation, the Movie",Comedy,A small community of descendants of Italian immigrants in the interior of the state of Rio Grande do Sul resorts to making a video to try to solve the problems of basic sanitation that plague their village.,"Fernanda Torres, Wagner Moura, Camila Pitanga",Jorge Furtado,N/A,112 min,N/A
2007,Super Sweet 16: The Movie,Comedy,Two best friends try to outdo each other as their respective sweet 16 parties approach.,"Joey Brander, Erin Bria, Giovanni Davis",Neema Barnette,Not Rated,86 min,N/A
2007,Doraemon the Movie: Nobita's New Great Adventure into the Underworld,"Animation, Adventure, Comedy","When Nobita turned the world into a world with magic with the what-if-telephone-booth-gadget, He and his world needed to defeat the threat that became reality in this world.","Wasabi Mizuta, Megumi Ôhara, Yumi Kakazu","Yukiyo Teramoto, Kôzô Kusuba",N/A,112 min,N/A
2008,Disaster Movie,"Comedy, Sci-Fi","Over the course of one evening, an unsuspecting group of twenty-somethings find themselves bombarded by a series of natural disasters and catastrophic events.","Carmen Electra, Vanessa Lachey, Nicole Parker","Jason Friedberg, Aaron Seltzer",PG-13,87 min,15
2008,Superhero Movie,"Action, Comedy, Sci-Fi","Orphaned high school student Rick Riker is bitten by a radioactive dragonfly, develops super powers (except for the ability to fly), and becomes a hero.","Drake Bell, Leslie Nielsen, Sara Paxton",Craig Mazin,PG-13,75 min,33
2008,The Onion Movie,Comedy,Satirical interpretations of world events and curious human behavior.,"Len Cariou, Sarah McElligott, Amir Talai","Tom Kuntz, Mike Maguire",Not Rated,86 min,N/A
2008,Extreme Movie,Comedy,A sketch-comedy movie about the joys and embarrassments of teen sex. But mostly the embarrassments.,"Frankie Muniz, Michael Cera, Ashley Schneider","Adam Jay Epstein, Andrew Jacobson",R,86 min,N/A
2008,Naruto Shippuden: The Movie - Bonds,"Animation, Action, Fantasy","A mysterious group of ninja called the Sora-nin from the Sky Country makes a surprise attack on Konoha. This is because Konoha nearly destroyed the Sky Country during the last Shinobi World War, yet they survived and now they're a...","Junko Takeuchi, Chie Nakamura, Noriaki Sugiyama",Hajime Kamegaki,TV-14,98 min,N/A
2008,Home Movie,"Drama, Horror, Thriller","In the remote woods of Upstate New York, David and Clare Poe are attempting to live an idyllic life. However, their twin children's bizarre behavior might just tear the family apart.","Lucian Maisel, Cady McClain, Adrian Pasdar",Christopher Denham,R,77 min,N/A
2008,Midnight Movie,"Fantasy, Horror, Thriller",A midnight showing of an early 1970's horror movie turns to chaos when the Killer from the movie comes out of the film to attack those in the theater.,"Rebekah Brandes, Daniel Bonjour, Greg Cirulnick",Jack Messitt,R,82 min,N/A
2008,Killer Movie,"Comedy, Horror, Mystery",A reality TV director copes with a spoiled celebutante and a show gone haywire when a masked killer starts bumping off the crew in this slasher-movie satire.,"Paul Wesley, Kaley Cuoco, Gloria Votsis",Jeff Fisher,R,93 min,N/A
2008,The Best Movie,Comedy,"Vadik Volnov dies on his own wedding of cannabis overdose and has to prove to God that he is worthy to enter Heaven. During his conversation with God's secretary, Vadik recalls numerous memorable moments of his earthly existence.","Garik Kharlamov, Mikhail Galustyan, Armen Dzhigarkhanyan",Kirill Kuzin,N/A,110 min,N/A
2008,Gurren Lagann the Movie: Childhood's End,"Animation, Action, Comedy","Simon and Kamina, brothers in arms, take upon themselves to venture beyond the borders of their world, reality and imagination. Venturing further and further into a hidden truth that has kept humanity prisoners for millennia.","Steve Blum, Johnny Yong Bosch, G.K. Bowes","Hiroyuki Imaishi, Shin Itagaki, Tarô Iwasaki",TV-PG,112 min,N/A
2009,Hannah Montana: The Movie,"Comedy, Drama, Family","As Hannah Montana's popularity begins to take over her life, Miley Stewart, on the urging from her father takes a trip to her hometown of Crowley Corners, Tennessee to get some perspective on what matters in life the most.","Miley Cyrus, Emily Osment, Billy Ray Cyrus",Peter Chelsom,G,102 min,47
2009,Wizards of Waverly Place: The Movie,"Action, Adventure, Comedy",A young wizard conjures a spell that puts her family in jeopardy.,"Selena Gomez, David Henrie, Jake T. Austin",Lev L. Spiro,TV-G,94 min,N/A
2009,Best Worst Movie,"Documentary, Comedy","A look at the making of the film Troll 2 (1990) and its journey from being crowned the ""worst film of all time"" to a cherished cult classic.","George Hardy, Pita Ray, Micki Knox",Michael Paul Stephenson,Not Rated,93 min,61
2009,Naruto Shippûden: The Movie 3: Inheritors of the Will of Fire,"Animation, Action, Fantasy","Ninjas with bloodline limits begin disappearing in all the countries and blame points toward the fire nation. By Tsunade's order, Kakashi is sacrificed to prevent an all out war. Naruto fights through friends and foes to prevent h...","Junko Takeuchi, Chie Nakamura, Satoshi Hino",Masahiko Murata,Not Rated,95 min,N/A
2009,Spanish Movie,Comedy,A spoof of contemporary Spanish movies.,"Alexandra Jiménez, Sílvia Abril, Carlos Areces",Javier Ruiz Caldera,N/A,83 min,N/A
2009,"Road, Movie","Adventure, Comedy, Crime",A young man's journey across the mythic Indian landscape becomes a life-changing odyssey.,"Abhay Deol, Satish Kaushik, Tannishtha Chatterjee",Dev Benegal,Not Rated,95 min,N/A
2009,Gurren Lagann the Movie: The Lights in the Sky are Stars,"Animation, Action, Drama","Seven years after the defeat of the Spiral King, Simon and the Dai-Gurren brigade must set out to the vastness of space to defeat a new threat and save the universe. The last high-stakes battle for Simon and his team is about to b...","Steve Blum, Johnny Yong Bosch, G.K. Bowes","Hiroyuki Imaishi, Yasuhiro Geshi, Hiroshi Ikehata",PG-13,126 min,N/A
2009,Nodame Cantabile: The Movie I,"Comedy, Drama, Music","Aspiring conductor Chiaki Shinichi and talented but undisciplined pianist Noda Megumi (nicknamed ""Nodame"") travel to Paris to pursue careers as classical musicians. Chiaki finds himself at the helm of an orchestra that has fallen ...","Juri Ueno, Hiroshi Tamaki, Eita Nagayama",Hideki Takeuchi,N/A,122 min,N/A
2009,Totally Spies! The Movie,"Animation, Action, Adventure","In their first mission as, like, total spies, three newly-befriended teen girls investigate the disappearances of people across Beverly Hills, uncovering a plot involving trendy makeover machines, a fancy space hotel and global de...","Andrea Baker, Katie Griffin, Jennifer Hale",Pascal Jardin,TV-Y7-FV,75 min,N/A
2009,Another Egg and Chicken Movie,"Animation, Action, Adventure","A witch egg has kidnapped Toto who is already a chicken, and he wants his heart for his magic trick, so Willy and his friends are going to rescue him.","Bruno Bichir, Carlos Espejel, Angélica Vale","Gabriel Riva Palacio Alatriste, Rodolfo Riva Palacio Alatriste",TV-Y7,90 min,N/A
2010,Fred: The Movie,"Adventure, Comedy, Family","Lovestruck, awkward teen Fred Figglehorn makes desperate attempts to make Judy fall in love with him - while also dodging the mischievous Kevin.","Lucas Cruikshank, Pixie Lott, Jake Weary",Clay Weiner,TV-PG,81 min,N/A
2010,"Ultramarines: A Warhammer 40,000 Movie","Animation, Action, Fantasy","A squad of Ultramarines answer a distress call from an Imperial Shrine World. A full Company of Imperial Fists was stationed there, but there is no answer from them. The squad investigates to find out what has happened there.","Terence Stamp, John Hurt, Sean Pertwee",Martyn Pick,R,76 min,N/A
2010,The Drawn Together Movie!,"Animation, Comedy, Mystery",Eight housemates on a fake animated reality TV show realize they've been canceled and set off on a journey to get back on the air.,"Adam Carolla, Carol Channing, Christine Ebersole",Greg Franklin,Unrated,70 min,N/A
2010,Bleach the Movie: Hell Verse,"Animation, Action, Adventure","When Ichigo's sister Yuzu is kidnapped by sinners &amp; he is asked to do something for them in order to get his sister released. Ichigo must find a way to take his sister back from hell with the help of Rukia, Renji &amp; Uryu.","Masakazu Morita, Fumiko Orikasa, Kazuya Nakai","Noriyuki Abe, Yuzuru Tachikawa",TV-14,94 min,N/A
2010,Khichdi: The Movie,"Comedy, Family","In order to immortalize his love, a groom decides to create conflict between his and his to-be bride's families.","Anang Desai, Supriya Pathak, Rajeev Mehta",Aatish Kapadia,Not Rated,120 min,N/A
2010,Gintama: The Movie,"Animation, Action, Comedy","The silver-haired samurai Sakata Gintoki investigates the disappearance of a legendary sword named Benizakura while his partners Kagura and Shimura Shinpachi try to find out what has happened to Gintoki's friend, Kotaro Katsura.","Tomokazu Sugita, Daisuke Sakaguchi, Rie Kugimiya",Shinji Takamatsu,TV-14,96 min,N/A
2010,The Parking Lot Movie,Documentary,"Hailed as the ""most feel-good film"" of the South by Southwest Film Festival 2010, The Parking Lot Movie follows a select group of artistic and overeducated parking lot attendants as they wage war against the people who park in the...","Patrick Baran, John Beers, Chris Farina",Meghan Eckman,PG,74 min,63
2010,Oki's Movie,"Comedy, Drama","A love story between a middle-aged professor, a young student who prepares a movie and a student/film-maker who drinks too much.","Lee Sun-kyun, Jung Yu-mi, Moon Sung-keun",Hong Sang-soo,Not Rated,80 min,78
2010,Iris: The Movie,"Action, Adventure, Drama","South Korean National Security Service normally deals with North Korea, but now NSS must deal with IRIS terrorists with a nuke.","Lee Byung-hun, Kim Tae-hee, Kim So-yeon","Kyoo-tae Kim, Yun-ho Yang",Not Rated,125 min,N/A
2010,Nodame Cantabile: The Movie II,"Comedy, Drama, Music","Nodame (Juri Ueno) is still pining for the affections of Chiaki (Hiroshi Tamaki), but Chiaki wants them to concentrate on their musical careers and moves out. Chiaki then gets the opportunity to perform with Song Rui (Yu Yamada) a...","Juri Ueno, Hiroshi Tamaki, Eita Nagayama","Yasuhiro Kawamura, Hideki Takeuchi",N/A,123 min,N/A
2011,The Greatest Movie Ever Sold,"Documentary, Comedy","A documentary about branding, advertising and product placement that is financed and made possible by brands, advertising and product placement.","J.J. Abrams, Peter Berg, Paul Brennan",Morgan Spurlock,PG-13,90 min,66
2011,Phineas and Ferb the Movie: Across the 2nd Dimension,"Animation, Action, Adventure","Phineas and Ferb discover that Perry is a secret agent, and they all get stuck in an alternate dimension where Doofenschmirtz is the ruler of the tri-state area.","Vincent Martella, Ashley Tisdale, Thomas Brodie-Sangster","Robert Hughes, Dan Povenmire, Jay Lender",TV-G,78 min,N/A
2011,Glee: The 3D Concert Movie,"Documentary, Comedy, Music","A concert mockumentary shot during the Glee Live In Concert 2011 tour, featuring song performances, backstage scenes and fans' stories on how the show influenced their lives.","Cory Monteith, Dianna Agron, Lea Michele","Kevin Tancharoen, Jennifer Arnold",PG,84 min,48
2011,Naruto Shippuden the Movie: Blood Prison,"Animation, Action, Fantasy",Naruto Uzumaki is framed and sent to an inescapable prison where he must escape by any means necessary.,"Junko Takeuchi, Chie Nakamura, Rikiya Koyama",Masahiko Murata,TV-14,108 min,N/A
