Year,Title,Genre,Plot,Actors,Director,Rated,Runtime,Metascore
1994,It's Pat: The Movie,Comedy,The comedic misadventures of a person of indeterminate gender.,"Julia Sweeney, Dave Foley, Charles Rocket",Adam Bernstein,PG-13,77 min,N/A
1994,Street Fighter II: The Animated Movie,"Animation, Action, Adventure","A crime boss searching for the world's best fighters pursues a talented Japanese drifter and his American ex-classmate, while an Interpol agent and a US Army captain seek to bring him down.","Kôjiro Shimizu, Kenji Haga, Miki Fujitani",Gisaburô Sugii,PG-13,102 min,N/A
1994,Sailor Moon S: The Movie - Hearts in Ice,"Animation, Action, Comedy","An unusual snow storm hits the town and the Sailor Scouts discover that an evil snow queen Kaguya, wants to freeze the entire earth. It's up to the Inner Sailor Scouts along with the Outers, to defeat the Queen. Meanwhile, Luna fa...","Kotono Mitsuishi, Aya Hisakawa, Michie Tomizawa",Hiroki Shibata,TV-14,60 min,N/A
1994,Slam Dunk: The Movie,"Animation, Short, Drama","Sakuragi and the Shohoko team takes on Oda and Takezono High School. This is Sakuragi's second match as he faces Oda, a basketball player who went to the same junior high.","Eriko Hara, Akiko Hiramatsu, Atsushi Kisaichi",Nobutaka Nishizawa,TV-PG,30 min,N/A
1994,Movie Days,Drama,The story of a boyhood spent in Iceland in the 1960s. Tomas loves the movies and is highly influenced by them.,"Örvar Jens Arnarsson, Rúrik Haraldsson, Sigrún Hjálmtýsdóttir",Friðrik Þór Friðriksson,N/A,82 min,N/A
1994,Fredrikssons fabrikk - The movie,Comedy,"This farcical movie takes place in a tiny dress factory in Norway. The company ""Fredrikssons Fashion"" is owned and run by a Swede. His employees are a bunch of ladies who think of their job as an opportunity for socializing for wh...","Magnus Härenstam, Brit Elisabeth Haagensli, Geir Kvarme",Bo Hermansson,N/A,92 min,N/A
1994,Murder or Memory: A Moment of Truth Movie,"Crime, Drama, Thriller",A mother fights to prove her 14-year-old son is innocent of a murder he confessed to under hypnosis.,"Leigh Taylor-Young, Michael Brandon, Karl David-Djerf",Christopher Leitch,N/A,105 min,N/A
1994,Fake Movie Page,N/A,N/A,N/A,Saji,N/A,N/A,N/A
1994,Amba - First Movie,"Animation, Short, Sci-Fi",People grow genetically modified plants using the brain of a dog and a man-octopus.,"Lyudmila Gnilova, Vsevolod Abdulov, Aleksandr Lushchik",Gennadiy Tishchenko,N/A,8 min,N/A
1994,1994 MTV Movie Awards,Family,The third annual MTV Movie Awards. Hosted by rapper and actor Will Smith.,"Will Smith, Tom Arnold, Backbeat, William Baldwin",Bruce Gowers,N/A,N/A,N/A
1995,A Goofy Movie,"Animation, Adventure, Comedy","When Max makes a preposterous promise to a girl he has a crush on, his chances to fulfilling it seem hopeless when he is dragged onto a cross-country trip with his embarrassing father, Goofy.","Bill Farmer, Jason Marsden, Jim Cummings",Kevin Lima,G,78 min,53
1995,The Brady Bunch Movie,Comedy,"The original 1970s TV family is now placed in the 1990s, where they're even more square and out of place than ever.","Shelley Long, Gary Cole, Christine Taylor",Betty Thomas,PG-13,90 min,54
1995,Trinity and Beyond: The Atomic Bomb Movie,"Documentary, History",The history of nuclear weapons between 1945 until 1963.,"William Shatner, Edward Teller, W.H.P. Blandy, Frank H. Shelton",Peter Kuran,Not Rated,92 min,N/A
1995,Sailor Moon SuperS: The Movie: Black Dream Hole,"Animation, Action, Comedy","When the Evil Madame Vadiane kidnaps Chibi-Usa, the senshi rush to her rescue with the aid of Chibi-Usa's new friend, Peruru. After trying to find Chibi-Usa and fight off Vadiane's henchmen to no avail, the three outer senshi (Nep...","Kotono Mitsuishi, Kae Araki, Michie Tomizawa",Hiroki Shibata,TV-14,75 min,N/A
1995,Gumby: The Movie,"Animation, Adventure, Comedy","In this offshoot of the 1950s ""claymation"" cartoon series, the crazy Blockheads threaten to ruin Gumby's benefit concert by replacing the entire city of Clokeytown with robots.","Dal McKennon, Art Clokey, Gloria Clokey",Art Clokey,G,90 min,N/A
1995,Macross Plus Movie Edition,"Animation, Action, Adventure",Two rival test pilots strive to be the best there is at what they do and also to win the heart of the woman behind the AI pop sensation Sharon Apple. Movie compilation of the acclaimed four-chapter OVA with additional scenes.,"Steve Blum, Rica Fukami, Banjô Ginga","Shôji Kawamori, Yûji Moriyama, Shin'ichirô Watanabe",N/A,115 min,N/A
1995,Wigstock: The Movie,Documentary,"Documentary/Concert film covering the annual Drag festival in New York City. Highlights include a performance by drag diva, Ru Paul, and the infamous Lypsinka.","RuPaul, John Epperson, Debbie Harry",Barry Shils,R,85 min,N/A
1995,Murder Was the Case: The Movie,"Short, Comedy, Crime, Drama, Horror, Music","Follows the exploits of Snoop Doggy Dogg as he gets shot, and makes a deal with the devil to survive.","Snoop Dogg, Charlie Murphy, Gregory Scott Cummins, Freez Luv","Dr. Dre, Fab 5 Freddy, F. Gary Gray, Ricky Harris",N/A,18 min,N/A
1995,Monster Mash: The Movie,"Comedy, Horror, Musical",Two teenagers get trapped in a house with Dr. Frankenstein who wants to transfer one of their brains to his creature.,"Ian Bohen, Candace Cameron Bure, Sarah Douglas","Joel Cohen, Alec Sokolow",PG,82 min,N/A
1995,Catnapped! The Movie,"Animation, Adventure, Family",Anthropomorphic cats abduct little kids' dog to use him as a weapon for their Mistress who wants to control the fantastical cat world. Young boy and his sister must travel to this world to save their pet and the cat world.,"Noriko Hidaka, Hiroaki Hiro, Mitsuo Iwata",Takashi Nakamura,N/A,77 min,N/A
1996,Mystery Science Theater 3000: The Movie,"Comedy, Drama, Fantasy",Mike Nelson and his robot companions watch and give their comments about This Island Earth (1955).,"Trace Beaulieu, Michael J. Nelson, Jim Mallon",Jim Mallon,PG-13,73 min,65
1996,Doctor Who: The Movie,"Adventure, Drama, Sci-Fi","The newly-regenerated Doctor takes on the Master on the turn of the millennium, 31 December 1999.","Paul McGann, Eric Roberts, Daphne Ashbrook",Geoffrey Sax,TV-14,89 min,N/A
1996,Tenchi the Movie - Tenchi Muyo in Love,"Animation, Adventure, Comedy","Tenchi and co. find their existence unsettled by a time-travelling entity called Kain. Desiring revenge upon the Juraian emperor, Tenchi, Kain travels back in time to kill Tenchi's mother. Trying to preserve the timestream, Tenchi...","Matt K. Miller, Megumi Hayashibara, Yuri Amano",Hiroshi Negishi,PG-13,95 min,N/A
1996,Black Jack: The Movie,"Animation, Drama, Thriller","The adventures of the unlicensed but genius doctor Black Jack, who encounters extraordinary people and phenomena as he attends to unusual medical cases.","Hiroshi Fujioka, Kirk Thornton, Akio Ôtsuka",Osamu Dezaki,Not Rated,90 min,N/A
1996,A Secret Between Friends: A Moment of Truth Movie,Drama,Two friends keep their vomiting a secret until one friend almost dies.,"Lynda Carter, Katie Wright, Marley Shelton",James A. Contner,N/A,96 min,N/A
1996,Hugo: The Movie Star,"Animation, Family, Musical","Hugo, the one-of-a-kind jungle animal, is snatched away from his home for a second time in another attempt for him to become an animal actor. Meanwhile, he's reunited with Rita the kind, streetwise fox. Finding that life in front ...","Kaya Brüel, Jesper Klein, Søs Egelind","Stefan Fjeldmark, Jørgen Lerdam, Flemming Quist Møller",N/A,68 min,N/A
1996,Hollywood: The Movie,"Comedy, Fantasy","An ambtious filmmaker sets out to make an avant-garde film but soon learns the only way he can secure financing is if he shows Jessica Hahn's breasts. Also, two old women are magically transformed into young starlets.","Julie Strain, Imogene Coca, Jessica Hahn, Morton Downey Jr.",Joseph Allen,Not Rated,98 min,N/A
1996,Mighty Ducks the Movie: The First Face-Off,"Animation, Action, Comedy, Family, Sci-Fi",This movie is a compilation of the first three episodes of the television series.,"Jim Belushi, Jeff Bennett, Clancy Brown, Townsend Coleman","Joe Barruso, Doug Murphy, Blair Peters, Baekyup Sung",Unrated,66 min,N/A
1996,Freebird: The Movie,Documentary,"See classic live performances, interviews and vintage footage of the original Lynyrd Skynyrd band.","Allen Collins, Steve Gaines, Billy Powell",Jeff G. Waxman,PG,101 min,N/A
1996,"The Typewriter, the Rifle & the Movie Camera","Documentary, Biography","In a documentary about Samuel Fuller, the spectator gets different impressions about the Hollywood director and his films. The film is divided into the three sections: The Typewriter, the Rifle and the Movie Camera. The first segm...","Samuel Fuller, Tim Robbins, Jim Jarmusch",Adam Simon,N/A,55 min,N/A
1997,The Batman Superman Movie: World's Finest,"Animation, Action, Adventure",Joker goes to Metropolis with an offer and plan to kill Superman for Lex Luthor while Batman pursues the clown to Superman's turf.,"Tim Daly, Dana Delany, Kevin Conroy",Toshihiko Masuda,TV-PG,64 min,N/A
1997,Turbo: A Power Rangers Movie,"Action, Adventure, Family","A space alien is threatening to bring destruction on Earth, and the Power Rangers are enhanced with turbo powers in order to prevent her plan.","Jason David Frank, Catherine Sutherland, Hilary Shepard","Shuki Levy, David Winning",PG,99 min,35
1997,Rurouni Kenshin: The Movie,"Animation, Action, Drama","The clashes between the two warriors, Himura Kenshin, a pacifist who wishes to stop a rebellion from Takimi Shigure and a band of desperate rebels who have sworn to settle one final score with society.","Mayo Suzukaze, Shanon Weaver, Miki Fujitani",Tsuji Hajiki,Not Rated,90 min,N/A
1997,Tenchi the Movie 2: The Daughter of Darkness,"Animation, Comedy, Fantasy","One hot summer day, a young girl suddenly appears in front of Tenchi claming the he's her papa! Everyone wonders who the mother could be, and this greatly upsets Ryoko, and she wants the new rival to leave. Lurking in the backgrou...","Masami Kikuchi, Ai Orikasa, Yumi Takada",Satoshi Kimura,PG-13,95 min,N/A
1997,The Wiggles Movie,"Adventure, Comedy, Family","The Wiggles throw a surprise party for Dorothy the Dinosaur, while she goes after a magician who takes Greg's magic wand to become popular.","Murray Cook, Jeff Fatt, Greg Page",Dean Covell,G,83 min,N/A
1997,Bimbo Movie Bash,"Comedy, Horror, Sci-Fi",A squadron of outer space bimbos decide to take revenge on the male chauvinists of Earth.,"Ian Abercrombie, Adrienne Barbeau, Michelle Bauer","Mike Mendez, Dave Parker",R,80 min,N/A
1997,Bad Movie,"Crime, Drama",A compilation of episodes from the lives of the 'bad teens' and the homeless of Seoul.,"Seul-ki Hang, Kyeong-won Park, Jae-kyeong Lee",Jang Sun-woo,N/A,144 min,N/A
1997,Dibu: The Movie,"Comedy, Family, Fantasy","When Caro and Marce go on vacation they find a new friend, Buji, and just like Dibu, she is a cartoon animated kid. Abu, Pepe, Víctor, Leo and Dibu are left alone at home and they have quite an adventure when they decide to sign-u...","Germán Kraus, Stella Maris Closas, Alberto Anchart","Carlos Olivieri, Alejandro Stoessel",N/A,105 min,N/A
1997,The Accident: A Moment of Truth Movie,Drama,"A preppy teenage girl from Seattle finds her life falling apart after she kills her best friend in a car accident by driving drunk. In spite of the tragedy, she continues to drink alcohol and hide it from her parents.","Donna Bullock, Matt McCoy, Teddi Siddall",Chuck Bowman,N/A,88 min,N/A
1997,1997 MTV Movie Awards,Documentary,The sixth annual MTV Movie Awards. Hosted by Mike Myers.,"Mike Myers, Gillian Anderson, David Arquette","Bruce Gowers, Troy Miller",N/A,N/A,N/A
1998,Pokémon: The First Movie - Mewtwo Strikes Back,"Animation, Action, Adventure","Scientists genetically create a new Pokémon, Mewtwo, but the results are horrific and disastrous.","Veronica Taylor, Rachael Lillis, Eric Stuart",Kunihiko Yuyama,G,96 min,35
1998,The Rugrats Movie,"Animation, Adventure, Comedy",The babies gets lost in the forest after Tommy Pickles gets a new baby brother.,"Elizabeth Daily, Christine Cavanaugh, Kath Soucie","Igor Kovalyov, Norton Virgien",G,79 min,62
1998,Rudolph the Red-Nosed Reindeer: The Movie,"Animation, Adventure, Family",It's up to Santa's most famous reindeer to save the day when an evil queen conjures up a storm on Christmas.,"John Goodman, Bob Newhart, Debbie Reynolds",William R. Kowalchuk Jr.,G,83 min,N/A
1998,Gundam Wing: The Movie - Endless Waltz,"Animation, Action, Drama","After Colony 196, Treize Kushrenada is dead and the 5 young soldiers known as the Gundam pilots have brought peace between Earth and the Colonies through Operation me. Now they move on with their lives and their Gundams are being ...","Mark Hildreth, Scott McNeil, Kirby Morrow","Yasunao Aoki, Nana Harada",N/A,90 min,N/A
1998,Hercules and Xena - The Animated Movie: The Battle for Mount Olympus,"Animation, Action, Adventure, Family, Fantasy",Hercules and Xena join forces to save the Gods of Olympus from the all-powerful Titans.,"Kevin Sorbo, Lucy Lawless, Michael Hurst, Renée O'Connor",Lynne Naylor,PG,80 min,N/A
1998,Beach Movie,Comedy,"Link is torn between the two loves of his life: surfing, and his girlfriend Sunny. He's also got to deal with an angry landlady who's threatening to evict him if he doesn't start paying his rent. When three rich but clueless newco...","Alex DeBoe, Gabrielle Anwar, Douglas Spain",John Quinn,R,90 min,N/A
1998,Broken Silence: A Moment of Truth Movie,Drama,"When a young track star is raped by her coach, no one but her mother will believe her story.","Ariana Richards, Susan Blakely, William Bumiller",Joseph L. Scanlan,N/A,87 min,N/A
1998,Shattered Hearts: A Moment of Truth Movie,"Drama, Romance","Teenager Julie's life changes forever when her high-school sweetheart Luke is diagnosed with leukemia. Together they try to make the best of things, intent on carrying out a dream vacation to Canada.","Beth Broderick, Scott Vickaryous, Katie Gratson",James A. Contner,N/A,89 min,N/A
1998,The Cowboy and the Movie Star,"Drama, Romance","Depressed at the thought of losing his family ranch to settle his divorce, cowboy Clint Brannan decides to drive his cattle up to their high pasture. One day into the drive Clint happens across actress Sean Livingston who has run ...","Sean Young, Perry King, Priscilla Barnes",Mark Griffiths,N/A,100 min,N/A
1998,Black Spring Break: The Movie,Comedy,"The tropical paradise of Daytona Beach plays host to its annual deluge of party-hungry college students, including a budding rapper and a football star, who dodge greedy athletic agents while looking for fun and romance.","Daron Fordham, Kenny Flyy, Le Kisha Raine",Marlon Parry,TV-MA,90 min,N/A
1999,Pokémon the Movie 2000,"Animation, Action, Adventure","Ash Ketchum must gather the three spheres of fire, ice and lightning in order to restore balance to the Orange Islands.","Veronica Taylor, Rica Matsumoto, Ikue Ôtani",Kunihiko Yuyama,G,99 min,28
1999,American Movie,"Documentary, Comedy",Documentary about an aspiring filmmaker's attempts to finance his dream project by finally completing the low-budget horror film he abandoned years before.,"Mark Borchardt, Mike Schank, Tom Schimmels",Chris Smith,R,107 min,84
1999,Batman Beyond: The Movie,"Animation, Action, Sci-Fi","Decades after the retirement of Bruce Wayne as Batman, a boy dons the identity to avenge his own father's murder.","Will Friedle, Kevin Conroy, Teri Garr","Curt Geda, Butch Lukic, Dan Riba",TV-Y7,41 min,N/A
1999,Doug's 1st Movie,"Animation, Adventure, Comedy",Doug and his pal Skeeter set out to find the monster of Lucky Duck Lake.,"Thomas McHugh, Fred Newman, Chris Phillips",Maurice Joyce,G,77 min,N/A
1999,The Underground Comedy Movie,Comedy,A series of comedic short films guaranteed to offend.,"Barbara Snellenburg, Rebekah Chaney, Gloria Sperling",Vince Offer,R,88 min,N/A
1999,Cardcaptor Sakura: The Movie,"Animation, Adventure, Comedy","Ten-year old Sakura Avalon, Cardcaptor of the elusive, magical Clow Cards, unexpectedly wins a trip to Hong Kong where strange dreams lead her to an imprisoned sorceress with close connections to the creator of the cards.","Sakura Tange, Aya Hisakawa, Junko Iwao","Morio Asaka, Terry Klassen",Not Rated,80 min,N/A
1999,Revolutionary Girl Utena: The Movie,"Animation, Action, Adventure","Utena Tenjou disguises herself as a boy for the Ohtori Academy, however she encounters trouble due to a ring which shows she's skilled duelist. As well as this, the vice president of the school challenges her to a duel","Tomoko Kawakami, Yuriko Fuchizaki, Leah Applebaum","Kunihiko Ikuhara, Shingo Kaneko, Katsushi Sakurabi",Not Rated,100 min,N/A
1999,Soccer Dog: The Movie,"Comedy, Family, Sport",A heart-warming comedy about the friendship between the new kid in town and a soccer-playing dog on the lam from the dog-catcher. It's up to these two underdogs to win the PeeWee Soccer League championship game.,"James Marshall, Olivia d'Abo, Jeremy Foley",Tony Giglio,PG,98 min,N/A
1999,GTO: The Movie,"Comedy, Drama",A live action film version of the hit Japanese TV series staring Takashi Sorimachi as Eikichi Onizuka.,"Takashi Sorimachi, Norika Fujiwara, Rena Tanaka",Masayuki Suzuki,N/A,108 min,N/A
1999,Dr. Quinn Medicine Woman: The Movie,"Drama, Western","When Dr. Mike and Sully's daughter Katie is kidnapped, they and a group of townsfolk travel to Mexico to rescue her.","Jane Seymour, Joe Lando, Eduardo Yáñez",James Keach,N/A,86 min,N/A
2000,Scary Movie,Comedy,"A year after disposing of the body of a man they accidentally killed, a group of dumb teenagers are stalked by a bumbling serial killer.","Anna Faris, Jon Abrahams, Marlon Wayans",Keenen Ivory Wayans,R,88 min,48
2000,The Tigger Movie,"Animation, Adventure, Comedy",Tigger goes looking through the hundred-acre-wood to find his family.,"Jim Cummings, Nikita Hopkins, Ken Sansom",Jun Falkenstein,G,77 min,53
2000,Pokémon 3 the Movie: Spell of the Unown,"Animation, Action, Adventure","In the town of Greenfield, a young, lonely girl's dreams and wishes are brought into reality by a collective of reality-warping Pokémon.","Veronica Taylor, Eric Stuart, Rica Matsumoto",Kunihiko Yuyama,G,93 min,N/A
2000,Left Behind: The Movie,"Action, Drama, Fantasy",The Biblical prophecy of Armegeddon begins when the Rapture instantly takes all believers in Christ from the Earth. A reporter left behind learns that the Anti-Christ will soon take power.,"Kirk Cameron, Brad Johnson, Janaya Stephens",Vic Sarin,PG-13,96 min,22
2000,An Extremely Goofy Movie,"Animation, Comedy, Family, Sport","Max goes to college, but to his embarassment his father loses his job and goes to his son's campus.","Bill Farmer, Jason Marsden, Jeff Bennett, Jim Cummings",Douglas McCarthy,G,79 min,N/A
2000,One Piece: The Movie,"Animation, Action, Adventure","There once was a pirate known as the Great Gold Pirate Woonan, who obtained almost 1/3 of the world's gold. Over the course of a few years, the pirate's existence faded, and a legend grew that he disappeared with his gold to a rem...","Akemi Okamura, Kappei Yamaguchi, Kazuya Nakai",Junji Shimizu,TV-PG,51 min,N/A
2000,Digimon: The Movie,"Animation, Action, Adventure","Throughout three different stories, Kari Kamiya and her friends take on explosive adventures involving digital creatures.","Lara Jill Miller, Joshua Seth, Bob Papenbrook","Bob Buchholz, Mamoru Hosoda, Jeff Nimoy",PG,82 min,20
2000,Escaflowne: The Movie,"Adventure, Animation, Drama","A grim retelling of the television series ""The Vision of Escaflowne"".","Shin'ichirô Miki, Jôji Nakata, Maaya Sakamoto","Kazuki Akane, Yoshiyuki Takei",PG-13,98 min,50
2000,Steal This Movie,"Biography, Drama, Romance","After years of hiding, the notorious American leftist radical, Abbie Hoffman, discusses his life, his cause and the opposition he endured.","Vincent D'Onofrio, Janeane Garofalo, Jeanne Tripplehorn",Robert Greenwald,R,107 min,36
2000,Homicide: The Movie,"Crime, Drama","Al Giardello is shot and the detectives of the Baltimore Homicide Unit return to work to solve the case, including Howard, Munch, Bayliss, Meldrick, Bolander and Kellerman.","Daniel Baldwin, Ned Beatty, Richard Belzer",Jean de Segonzac,PG-13,88 min,N/A
2001,Scary Movie 2,"Comedy, Horror",Four teens are tricked by a professor into visiting a haunted house for a school project.,"Anna Faris, Marlon Wayans, Antony Acker",Keenen Ivory Wayans,R,83 min,29
2001,Not Another Teen Movie,Comedy,A sendup of all the teen movies that have accumulated in the past two decades.,"Chyler Leigh, Jaime Pressly, Chris Evans",Joel Gallen,R,89 min,32
2001,Cowboy Bebop: The Movie,"Animation, Action, Crime","A terrorist explosion releases a deadly virus on the masses, and it's up to the bounty-hunting Bebop crew to catch the cold-blooded culprit.","Beau Billingslea, Melissa Fahn, Nicholas Guest","Shin'ichirô Watanabe, Tensai Okamura, Hiroyuki Okiura",TV-14,115 min,61
2001,Samurai Jack: The Premiere Movie,"Animation, Action, Adventure","In ancient Japan, a samurai warrior embarks on a mission to defeat the evil wizard Aku. Before completing his task, he is jettisoned thousands of years into the future. Suddenly, he discovers he is in a world where Aku now enjoys ...","Jeff Bennett, Grey Griffin, Phil LaMarr","Genndy Tartakovsky, Robert Alvarez, Randy Myers",TV-Y7,90 min,N/A
2001,Inuyasha the Movie: Affections Touching Across Time,"Animation, Action, Adventure","During their journey, Inuyasha, Kagome and their party are attacked by Menoumaru, a monster who is looking for Tessaiga, Inuyasha's sword, to an unknown end.","Kappei Yamaguchi, Satsuki Yukino, Kôji Tsujitani",Toshiya Shinohara,Not Rated,100 min,N/A
2001,Christmas Carol: The Movie,"Animation, Family, Fantasy",Old bitter miser Ebenezer Scrooge (Simon Callow) who makes excuses for his uncaring nature learns real compassion when three ghosts visit him on Christmas Eve.,"Simon Callow, Kate Winslet, Nicolas Cage",Jimmy T. Murakami,PG,77 min,N/A
2001,Jett Jackson: The Movie,"Action, Adventure, Comedy",Jett decides to quit Silverstone and lead a normal life. On the day of his last episode he is hit on the head with a prop and in his dream he is Silverstone. He is the only one who realizes that this is a dream.,"Lee Thompson Young, Lindy Booth, Nigel Shawn Williams",Shawn Levy,PG,100 min,N/A
2001,Home Movie,Documentary,Documentary look at five unusual homes and the people who built (or adapted) them.,"Ed Peden, Ben Skora, Diana Peden",Chris Smith,TV-14,66 min,67
2001,Azumanga Daioh: The Very Short Movie,"Animation, Comedy, Short",A short compilation of humourous sketches featuring a group of friends in high school.,"Tomoko Kaneda, Yu Asakawa, Chieko Higuchi",Hiroshi Nishikiori,TV-PG,6 min,N/A
2001,Shenmue: The Movie,"Action, Adventure, Crime",Follow Ryo Hazuki as he attempts to track down the man responsible for his father's death.,"Ryan Drees, Lynn Harris, Ruth Hollyman",Yu Suzuki,N/A,88 min,N/A
2002,Jackass: The Movie,"Documentary, Action, Comedy",Johnny Knoxville and his band of maniacs perform a variety of stunts and gross-out gags on the big screen for the first time.,"Johnny Knoxville, Bam Margera, Chris Pontius",Jeff Tremaine,R,85 min,42
2002,The Powerpuff Girls Movie,"Animation, Action, Adventure","After destroying the city of Townsville in a game of tag, a trio of super-powered little girls must redeem themselves by stopping a vengeful monkey's plot for world domination.","Cathy Cavadini, Tara Strong, Elizabeth Daily",Craig McCracken,PG,73 min,65
2002,Hey Arnold! The Movie,"Animation, Adventure, Comedy",Arnold and company must recover a stolen document needed in order to prevent the neighborhood from being bulldozed.,"Spencer Klein, Francesca Marie Smith, Jamil Walker Smith",Tuck Tucker,PG,76 min,47
2002,It's a Very Merry Muppet Christmas Movie,"Adventure, Comedy, Family","After the Muppet Theater faces closure on account of financial hardships, angel Daniel requests Boss to help its owner Kermit the Frog and his team of muppets","Steve Whitmire, Dave Goelz, Bill Barretta",Kirk R. Thatcher,TV-G,100 min,N/A
2002,Jonah: A VeggieTales Movie,"Animation, Adventure, Comedy","When the singing Veggies encounter some car trouble, they are stranded at an old rundown seafood joint, where nothing is quite as it seems.","Phil Vischer, Mike Nawrocki, Tim Hodge","Phil Vischer, Mike Nawrocki",G,82 min,58
2002,Hundtricket - The Movie,"Comedy, Drama, Romance",A shy but very romantic young man tries to meet a girl by walking a borrowed dog. The trick works unbelievably well. They fall in love.,"Linus Wahlgren, Josephine Bornebusch, Alexander Skarsgård","Christian Eklöw, Christopher Panov",N/A,106 min,N/A
2002,InuYasha the Movie 2: The Castle Beyond the Looking Glass,"Animation, Action, Comedy","After seemingly defeating their common enemy, Naraku, what appears to be the near-end of their journey instead leads Inuyasha and Kagome facing against a new threat.","Kappei Yamaguchi, Satsuki Yukino, Kôji Tsujitani",Toshiya Shinohara,Not Rated,99 min,N/A
2002,2002 MTV Movie Awards,N/A,The eleventh annual MTV Movie Awards on MTV. Hosted by Jack Black and Sarah Michelle Gellar.,"Jack Black, Sarah Michelle Gellar, Kate Beckinsale",Bruce Gowers,N/A,120 min,N/A
2002,Joan Crawford: The Ultimate Movie Star,Documentary,"In this documentary on the life of Joan Crawford, it is learned why she should be remembered as the great actress she was, and not only as the ""Mommie Dearest"" caricature she has become. Friends, fellow actors, directors, and othe...","Anjelica Huston, Diane Baker, Charles Busch",Peter Fitzgerald,Unrated,87 min,N/A
